{
  "case_number": "2024-2296",
  "title": "Acme Corp. v. Widget Technology, Inc.",
  "opinion_type": "Rule 36 Judgment",
  "date_issued": "2025-09-12",
  "outcome": "Remanded",
  "judges": [
    "Chen",
    "Prost",
    "Stoll"
  ],
  "authoring_judge": "Chen",
  "subject_matter": "Veterans Benefits",
  "pdf_url": "https://www.cafc.uscourts.gov/opinions-orders/24-2296.OPINION.9-12-2025.pdf",
  "is_precedential": false
}